{
  "plan_id": "PLAN-H1I7QF9R",
  "version": "1.1",
  "created_at": "2026-01-17T11:43:12.714392",
  "objective": {
    "description": "Test de generacion con self-correction",
    "success_criteria": [
      "Cambios implementados correctamente",
      "Tests pasando",
      "Sin errores de lint"
    ],
    "affected_files": []
  },
  "pre_flight_check": {
    "git_status": "clean",
    "lint_passed": true,
    "tests_passed": true
  },
  "steps": [
    {
      "id": "S01",
      "action": "read_file",
      "target": ".",
      "expected_outcome": "Entender estructura actual",
      "hitl_required": false
    },
    {
      "id": "S02",
      "action": "lint_check",
      "target": ".",
      "expected_outcome": "Sin errores de sintaxis",
      "depends_on": [
        "S01"
      ],
      "hitl_required": false
    }
  ],
  "verification": {
    "method": "automated",
    "commands": [
      "python scripts/lint_check.py .",
      "python scripts/type_check.py ."
    ],
    "expected_results": [
      "Lint passed",
      "Type check passed"
    ]
  },
  "evidence": {
    "logs": [],
    "analyzed_paths": []
  },
  "commit_proposal": {
    "type": "feat",
    "scope": "core",
    "message": "Test de generacion con self-correction"
  }
}